{"schemaVersion":"policystrata.runtime_manifest.v1","version":"runtime.fixture","defaultDecision":"deny","resources":[{"name":"support_tickets","type":"table","actions":[{"name":"read","allowedRoles":["support_manager"]}]}],"controls":{"authContext":{"requiredFields":["userId","tenantId","role"]},"sql":{"tenantColumn":"tenant_id"}}}
